{"$schema":"https://json-schema.org/draft/2020-12/schema","$id":"orchestrator-engine://schemas/metrics-generation","title":"Metrics generation","schema_version":1,"kind":"ORCHESTRATOR_METRICS_GENERATION","type":"object","required":["schema_version","kind","generation_digest","created_at","generation_sequence","parent_generation","registry_digest","segment_digests"],"properties":{"schema_version":{"const":1},"kind":{"const":"ORCHESTRATOR_METRICS_GENERATION"},"generation_digest":{"type":"string","pattern":"^[0-9a-f]{64}$"},"created_at":{"type":"string","format":"date-time"},"generation_sequence":{"type":"integer","minimum":0},"parent_generation":{"type":["string","null"],"pattern":"^[0-9a-f]{64}$"},"registry_digest":{"type":"string","pattern":"^[0-9a-f]{64}$"},"segment_digests":{"type":"array","items":{"type":"string","pattern":"^[0-9a-f]{64}$"},"uniqueItems":true}},"additionalProperties":false}
