{"schema_version":1,"kind":"ORCHESTRATOR_METRICS_GENERATION","generation_digest":"aaaaaaaaaaaaaaaaaaaaaaaaaaaaaaaaaaaaaaaaaaaaaaaaaaaaaaaaaaaaaaaa","created_at":"2026-09-08T10:02:00Z","generation_sequence":0,"parent_generation":null,"registry_digest":"bbbbbbbbbbbbbbbbbbbbbbbbbbbbbbbbbbbbbbbbbbbbbbbbbbbbbbbbbbbbbbbb","segment_digests":[]}
